<!DOCTYPE block SYSTEM "../dtds/blockLibrary.dtd">
<block inherits="ListModel" name="HOrientationModel">
  <assignments>
    <property name="valueForm">dssid</property>
    <property name="items">
      <list>
        <block listElementKey="K735" name="ItemInfo">
          <property name="dssid">0</property>
          <property name="n">{desc:mstrWeb.3691|Horizontal}</property>
        </block>
        <block listElementKey="K736" name="ItemInfo">
          <property name="dssid">1</property>
          <property name="n">{desc:mstrWeb.3692|Vertical}</property>
        </block>
      </list>
    </property>
  </assignments>
</block>
<!-- Used for orientation models that need Horizontal to be the first option. -->
